{
  "baseline_locks": {
    "v0.14": "7b6cfd89de570c4b945d574dad570c37825645fe",
    "v0.15_release": "ea46629558ff57970f6efd2485a7e9a288dc55f2",
    "v0.15_seal": "5ba6989aade68461c8f3953c4a82cc0e158b0730"
  },
  "coverage": {
    "accepted_edges": 0,
    "counter_evidence": "COMPETING_MODEL_CANDIDATE_ONLY",
    "exhaustive": false,
    "observed_retractions": 0,
    "scope": "EXISTING_SIX_NODE_FOUR_EDGE_REVIEW_FIXTURE"
  },
  "curated_edge_ids": [
    "edge:bq001:author-correction:martial-2025",
    "edge:bq001:has-model:biological-dependence"
  ],
  "edges": [
    {
      "accepted_edge": false,
      "assertion_class": "DIRECT_SOURCE_METADATA",
      "edge_id": "edge:bq001:author-correction:martial-2025",
      "edge_state": "CORRECTED_NOT_RETRACTED",
      "evidence_independence_keys": [
        "source:bq001:evidence-batch2-v0.1"
      ],
      "parent_edge_ids": [],
      "provenance": {
        "artifact_id": "artifact:bq001-evidence-batch2:0.1",
        "derivation_method": "DIRECT_RECORD",
        "independence_key": "source:bq001:evidence-batch2-v0.1",
        "public_safe": true,
        "record_locator": "/sources/4/related_notices/0/doi",
        "repository_path": "references/big-questions/BQ001/evidence-batch2-v0.1.json",
        "sha256": "ddcf9bf5f909a98f289b7ef816673f23cd0ec8ae26b8416c15d87b8690926cc1"
      },
      "relationship_type": "CORRECTS",
      "review_state": "SOURCE_ASSERTED",
      "source_node_id": "node:notice:doi:10.1038-s41582-025-01111-9",
      "target_node_id": "node:source:SRC-BQ001-MARTIAL-2025"
    },
    {
      "accepted_edge": false,
      "assertion_class": "INFERRED_CANDIDATE",
      "edge_id": "edge:bq001:claim-supports-biological-dependence:candidate",
      "edge_state": "REVIEW_ONLY",
      "evidence_independence_keys": [
        "source:bq001:evidence-batch2-v0.1"
      ],
      "parent_edge_ids": [],
      "provenance": {
        "artifact_id": "artifact:bq001-evidence-batch2:0.1",
        "derivation_method": "HUMAN_REVIEW_CANDIDATE",
        "independence_key": "source:bq001:evidence-batch2-v0.1",
        "public_safe": true,
        "record_locator": "/claims/4/supports_models/0",
        "repository_path": "references/big-questions/BQ001/evidence-batch2-v0.1.json",
        "sha256": "ddcf9bf5f909a98f289b7ef816673f23cd0ec8ae26b8416c15d87b8690926cc1"
      },
      "relationship_type": "SUPPORTS_MODEL_CANDIDATE",
      "review_state": "REVIEW_REQUIRED",
      "source_node_id": "node:claim:CLAIM-BQ001-MARTIAL-2025-INTERP-01",
      "target_node_id": "node:model:MODEL-BQ001-BIOLOGICAL-DEPENDENCE"
    },
    {
      "accepted_edge": false,
      "assertion_class": "DIRECT_SOURCE_METADATA",
      "edge_id": "edge:bq001:has-model:biological-dependence",
      "edge_state": "ACTIVE",
      "evidence_independence_keys": [
        "source:bq001:spec-v0.1"
      ],
      "parent_edge_ids": [],
      "provenance": {
        "artifact_id": "artifact:bq001-spec:0.1",
        "derivation_method": "DIRECT_RECORD",
        "independence_key": "source:bq001:spec-v0.1",
        "public_safe": true,
        "record_locator": "/models/1/model_id",
        "repository_path": "references/big-questions/BQ001/spec-v0.1.json",
        "sha256": "0a0f1fc57b55df100fb8583fc6e28cd38324737c460465ea2269a51f637d4819"
      },
      "relationship_type": "HAS_MODEL",
      "review_state": "SOURCE_ASSERTED",
      "source_node_id": "node:question:BQ001",
      "target_node_id": "node:model:MODEL-BQ001-BIOLOGICAL-DEPENDENCE"
    },
    {
      "accepted_edge": false,
      "assertion_class": "INFERRED_CANDIDATE",
      "edge_id": "edge:bq001:models-compete:candidate",
      "edge_state": "REVIEW_ONLY_CONTRADICTION",
      "evidence_independence_keys": [
        "source:bq001:spec-v0.1"
      ],
      "parent_edge_ids": [],
      "provenance": {
        "artifact_id": "artifact:bq001-spec:0.1",
        "derivation_method": "HUMAN_REVIEW_CANDIDATE",
        "independence_key": "source:bq001:spec-v0.1",
        "public_safe": true,
        "record_locator": "/models",
        "repository_path": "references/big-questions/BQ001/spec-v0.1.json",
        "sha256": "0a0f1fc57b55df100fb8583fc6e28cd38324737c460465ea2269a51f637d4819"
      },
      "relationship_type": "COMPETES_WITH_CANDIDATE",
      "review_state": "REVIEW_REQUIRED",
      "source_node_id": "node:model:MODEL-BQ001-BIOLOGICAL-DEPENDENCE",
      "target_node_id": "node:model:MODEL-BQ001-CONTINUITY"
    }
  ],
  "finality": "NEVER_FINAL",
  "guards": {
    "edge_acceptance": false,
    "identity_promotion": false,
    "private_drive_data": false,
    "public_status_inference": false,
    "ranking_promotion": false,
    "rights_inference": false,
    "safety_efficacy_promotion": false,
    "scientific_evidence_promotion": false,
    "truth_inference": false
  },
  "inferred_edge_ids": [
    "edge:bq001:claim-supports-biological-dependence:candidate",
    "edge:bq001:models-compete:candidate"
  ],
  "input": {
    "repository_path": "references/big-questions/BQ001/knowledge-graph-beta-fixture-v0.16.json",
    "sha256": "bb501c962b54c88b581ca6911e6377cdd0e18e12c34d0bd04ffcaa0dcae5cca3"
  },
  "mode": "REVIEW_ONLY",
  "nodes": [
    {
      "label": "A 2025 neuroscientific review proposes that converging neurophysiological processes can account for major features of near-death experiences without treating NDE phenomenology as direct evidence of consciousness outside brain function.",
      "node_id": "node:claim:CLAIM-BQ001-MARTIAL-2025-INTERP-01",
      "node_type": "CLAIM",
      "provenance": {
        "artifact_id": "artifact:bq001-evidence-batch2:0.1",
        "derivation_method": "DIRECT_RECORD",
        "independence_key": "source:bq001:evidence-batch2-v0.1",
        "public_safe": true,
        "record_locator": "/claims/4/claim_id",
        "repository_path": "references/big-questions/BQ001/evidence-batch2-v0.1.json",
        "sha256": "ddcf9bf5f909a98f289b7ef816673f23cd0ec8ae26b8416c15d87b8690926cc1"
      },
      "record_id": "CLAIM-BQ001-MARTIAL-2025-INTERP-01"
    },
    {
      "label": "biological_dependence_model",
      "node_id": "node:model:MODEL-BQ001-BIOLOGICAL-DEPENDENCE",
      "node_type": "MODEL",
      "provenance": {
        "artifact_id": "artifact:bq001-spec:0.1",
        "derivation_method": "DIRECT_RECORD",
        "independence_key": "source:bq001:spec-v0.1",
        "public_safe": true,
        "record_locator": "/models/1/model_id",
        "repository_path": "references/big-questions/BQ001/spec-v0.1.json",
        "sha256": "0a0f1fc57b55df100fb8583fc6e28cd38324737c460465ea2269a51f637d4819"
      },
      "record_id": "MODEL-BQ001-BIOLOGICAL-DEPENDENCE"
    },
    {
      "label": "continuity_or_survival_model",
      "node_id": "node:model:MODEL-BQ001-CONTINUITY",
      "node_type": "MODEL",
      "provenance": {
        "artifact_id": "artifact:bq001-spec:0.1",
        "derivation_method": "DIRECT_RECORD",
        "independence_key": "source:bq001:spec-v0.1",
        "public_safe": true,
        "record_locator": "/models/0/model_id",
        "repository_path": "references/big-questions/BQ001/spec-v0.1.json",
        "sha256": "0a0f1fc57b55df100fb8583fc6e28cd38324737c460465ea2269a51f637d4819"
      },
      "record_id": "MODEL-BQ001-CONTINUITY"
    },
    {
      "label": "Author Correction: A neuroscientific model of near-death experiences",
      "node_id": "node:notice:doi:10.1038-s41582-025-01111-9",
      "node_type": "NOTICE",
      "provenance": {
        "artifact_id": "artifact:bq001-evidence-batch2:0.1",
        "derivation_method": "DIRECT_RECORD",
        "independence_key": "source:bq001:evidence-batch2-v0.1",
        "public_safe": true,
        "record_locator": "/sources/4/related_notices/0/doi",
        "repository_path": "references/big-questions/BQ001/evidence-batch2-v0.1.json",
        "sha256": "ddcf9bf5f909a98f289b7ef816673f23cd0ec8ae26b8416c15d87b8690926cc1"
      },
      "record_id": "10.1038/s41582-025-01111-9"
    },
    {
      "label": "Does consciousness continue beyond the individual?",
      "node_id": "node:question:BQ001",
      "node_type": "QUESTION",
      "provenance": {
        "artifact_id": "artifact:bq001-spec:0.1",
        "derivation_method": "DIRECT_RECORD",
        "independence_key": "source:bq001:spec-v0.1",
        "public_safe": true,
        "record_locator": "/id",
        "repository_path": "references/big-questions/BQ001/spec-v0.1.json",
        "sha256": "0a0f1fc57b55df100fb8583fc6e28cd38324737c460465ea2269a51f637d4819"
      },
      "question_status": "UNRESOLVED",
      "record_id": "BQ001"
    },
    {
      "label": "A neuroscientific model of near-death experiences",
      "node_id": "node:source:SRC-BQ001-MARTIAL-2025",
      "node_type": "SOURCE",
      "provenance": {
        "artifact_id": "artifact:bq001-evidence-batch2:0.1",
        "derivation_method": "DIRECT_RECORD",
        "independence_key": "source:bq001:evidence-batch2-v0.1",
        "public_safe": true,
        "record_locator": "/sources/4/source_id",
        "repository_path": "references/big-questions/BQ001/evidence-batch2-v0.1.json",
        "sha256": "ddcf9bf5f909a98f289b7ef816673f23cd0ec8ae26b8416c15d87b8690926cc1"
      },
      "record_id": "SRC-BQ001-MARTIAL-2025"
    }
  ],
  "question_id": "BQ001",
  "question_status": "UNRESOLVED",
  "schema_version": "akashicnet.bq001.question-graph.v0.1",
  "source_artifacts": [
    {
      "artifact_id": "artifact:bq001-evidence-batch2:0.1",
      "independence_key": "source:bq001:evidence-batch2-v0.1",
      "public_safe": true,
      "repository_path": "references/big-questions/BQ001/evidence-batch2-v0.1.json",
      "sha256": "ddcf9bf5f909a98f289b7ef816673f23cd0ec8ae26b8416c15d87b8690926cc1"
    },
    {
      "artifact_id": "artifact:bq001-spec:0.1",
      "independence_key": "source:bq001:spec-v0.1",
      "public_safe": true,
      "repository_path": "references/big-questions/BQ001/spec-v0.1.json",